id,title,company,location,link,date,seniority,employment_type,industries,description,job_function
4042216764,Performance Associate - Commercial,MEDZnMORE,"Lahore, Punjab, Pakistan",https://pk.linkedin.com/jobs/view/performance-associate-commercial-at-medznmore-4042216764?position=9&pageNum=7&refId=8uUuD12jgqH0op%2FGXX8TEQ%3D%3D&trackingId=CXNqAmV9HqmJdkyZXOK2Mw%3D%3D,2024-10-07,Entry level,Full-time,"Health, Wellness & Fitness","Job Description
Company Overview:
MedznMore is a digital healthcare innovator, dedicated towards improving access to healthcare by blending technology and innovation to solve problems associated with modern day pharmacies.
The company is on a mission to simplify two major pain points in the Healthcare industry. The first is access to healthcare services which includes lab tests, health insurance and access to medicine, through our B2C platform (Tabiyat.pk). The second is a technology solution for the fragmented medicine supply chain by a B2B Platform (Tezmedz), which is supplying directly to retail pharmacies across Pakistan. The company today has an integrated B2B and B2C Platform.
Key Responsibilities
Identify areas of business underperformance and propose initiatives to improve performance.
Perform targeted analyses to identify issue root causes when performance targets are not met.
Create and design Performance & Utilization Success metrices and design processes and SQL queries to measure them.
Assist team lead to devise strategies and tools for business teams in reaching performance goals and agreed targets.
Work on the development and implementation of forecasting models.
Determine the impacting business factors and their impact on business & forecasting models.
Assist local teams in comparison of forecasts to actual performance, identifying reasons behind department performance and results.
Create tools & dashboards for Daily/Weekly & Monthly business performance visibility.
Maintain and monitor department/organizational KPIs.
Requirements
Bachelor's degree/Masters in STEM (Science, Technology, Engineering, Mathematics), or Economics. from top tier Institution.
1-3 years of experience
Excel & SQL proficeincy
Must be adept at creating dashboards
Python knowledge would be a plus
Understanding of PowerBI is a plus
Ability to structure / source data into data warehouse, and automate processes that support business
Benefits
A culture that empowers you to take the lead and deliver extraordinary results
A dynamic team that inspires you to be your best self
A purposeful role with mentorship from an experienced founding team
Quick career growth in one the fastest growing and well-funded tech start-ups in the region
A chance to explore new avenues, interact cross functionally and independently execute new and exciting ideas
An opportunity to get on board to revolutionize the Pakistani pharma industry
A competitive compensation and insurance plan to take care of yourself and your families
check(event) ; career-website-detail-template-2 => apply(record.id,meta)"" mousedown=""lyte-button => check(event)"" final-style=""background-color:#00ABE3;border-color:#00ABE3;color:white;"" final-class=""lyte-button lyteBackgroundColorBtn lyteSuccess"" lyte-rendered="""">
Show more
Show less",Sales and Management
4311707591,Full Stack Engineer,Softpers,"Lahore, Punjab, Pakistan",https://pk.linkedin.com/jobs/view/full-stack-engineer-at-softpers-4311707591?position=10&pageNum=7&refId=8uUuD12jgqH0op%2FGXX8TEQ%3D%3D&trackingId=dOCcbXJ1Au5zAMOPf6f%2B6g%3D%3D,2025-10-07,Executive,Full-time,IT Services and IT Consulting,"Job Description
Full Stack Engineer
Key Responsibilities:
Design, build, and maintain scalable backend services using Python, Django, and FastAPI
Develop responsive and interactive frontend applications using Next.js and React
Integrate frontend and backend systems seamlessly
Work closely with designers, project managers, and QA engineers
Write clean, reusable, and efficient code with proper documentation
Participate in code reviews and team discussions to maintain high-quality development standards
Work confidently with AI integrations (e.g., OpenAI APIs, LLM-based tools) to build intelligent features
Utilize developer tools like CursorAI, Claude Code, GitHub Copilot, etc., to accelerate development
Requirements:
Minimum 2 years of hands-on experience with Python and at least one web framework (FastAPI, Django)
Solid understanding of Next.js, React.js, and JavaScript
Experience integrating REST APIs and working with backend/frontend communication
Familiarity with Git and version control systems
Prior experience or strong interest in building features using AI/LLM APIs (e.g., OpenAI, Anthropic)
Comfort using AI developer tools like CursorAI, Claude Code, or similar for productivity
Strong problem-solving skills and attention to detail
Excellent communication and collaboration skills in a team environment
Salary Range: 100k to 160k
Location: Onsite
Shift: 2 PM to 11 PM
Additional Information
Compensation
Salary: PKR 200,000 per month
Show more
Show less",Engineering and Information Technology
4304617605,Project Data Analyst,Bayut & Dubizzle,"Lahore, Punjab, Pakistan",https://pk.linkedin.com/jobs/view/project-data-analyst-at-bayut-dubizzle-4304617605?position=1&pageNum=10&refId=9VFj1eTIYdrcYfE663juvQ%3D%3D&trackingId=hfa8qfmFdrDgMBr%2F8YtPYA%3D%3D,2025-09-23,Not Applicable,Full-time,"Real Estate, Construction, and Surveying and Mapping Services","Dubizzle Labs is the technology arm of Dubizzle Group, the number one classifieds platform in the MENA region. We are dedicated to building scalable solutions and digital marketplaces that serve millions of users across 10 countries. Our mission is to leverage technology to add value and solve local market challenges, and we are looking for a highly organized and detail-oriented
Project Data Analyst
to join our team. This role is critical to our platform's commercial success, ensuring our data is accurate, up-to-date, and readily available for our customers.
Position Summary
The Project Data Analyst will be responsible for the end-to-end management of our project inventory, ensuring the availability of new and historical real estate units is accurately reflected on our platform. This role involves processing various data formats, communicating with developer partners, and maintaining data integrity in a fast-paced environment.
Key Responsibilities
Inventory Management:
Process and upload new inventory lists provided by our developer partners and the internal PM team. This includes manually and programmatically entering data from various sources such as PDFs, Excel files, and screenshots.
Data Integrity:
Meticulously update unit pricing, add new units, and mark unavailable units to ensure our live inventory data is always current. Identify and add additional data points like unit layouts, views, and exposure to enhance the quality of our listings.
Stakeholder Communication:
Serve as the primary point of contact for approximately 200 developers and their sales teams. Proactively establish and maintain a communication pipeline (via email, WhatsApp, and Telegram) to request updated availability lists and information on new project launches.
Timely Updates:
Action daily updates for new and existing projects, ensuring new inventory is added within hours of receipt. Manage and fill in data gaps for historical projects as needed to maintain a comprehensive database.
Continuous Improvement:
Work with our development teams to identify opportunities for programmatic data uploads and API integrations to streamline the data ingestion process.
Qualifications
Experience:
Proven experience in a data entry, data analysis, or administrative role, with a strong emphasis on accuracy and attention to detail.
Technical Skills:
Proficient in using data management systems and familiar with processing various file formats (Excel, PDF, etc.). Experience with CRM or data entry platforms is a plus.
Communication:
Excellent verbal and written communication skills are a must. You must have
fluency in English
to effectively communicate with our external partners.
Organizational Skills:
Highly organised with the ability to manage multiple priorities and deadlines in a dynamic environment.
Self-Starter:
A proactive and diligent individual who can work independently to achieve daily and weekly data management goals.
Why Join Us?
This is a fantastic opportunity for a motivated individual to play a pivotal role in a growing tech company. You will be at the heart of our data operations, directly impacting our business's commercial viability and success. Dubizzle Labs takes pride in having a modern product culture where we use the best resources to polish your knowledge and skills, and we offer a supportive and dynamic work environment.
Show more
Show less",Information Technology and Engineering
4315157823,Performance Test Engineer,Soliton Technologies,"Lahore, Punjab, Pakistan",https://pk.linkedin.com/jobs/view/performance-test-engineer-at-soliton-technologies-4315157823?position=2&pageNum=10&refId=9VFj1eTIYdrcYfE663juvQ%3D%3D&trackingId=FgQ5fnUXEkpXPH%2Fgf8Q%2Bsg%3D%3D,2025-10-15,Mid-Senior level,Full-time,IT Services and IT Consulting,"Job Description
We are seeking a skilled Performance Test Engineer to join our dynamic team at Persivia | Soliton Technologies. In this role, you will play a crucial part in ensuring the quality and performance of our software applications by developing, executing, and analyzing performance tests.
Responsibilities
Develop and execute comprehensive performance test plans to ensure high-quality software applications.
Participate in test planning, and create detailed test cases and scripts.
Execute performance tests and analyze the results to identify potential issues.
Collect and analyze data from performance tests to provide actionable insights.
Document all identified problems and collaborate with the development team to resolve them.
Automate performance tests where feasible to enhance efficiency.
Utilize JMeter and its plugins effectively.
Demonstrate a strong understanding of performance metrics and the interpretation of results.
Employ additional tools such as SQL, network analysis, and Java tools to investigate performance-related issues.
Maintain thorough documentation and reporting practices.
Experience in performance test automation is advantageous.
Qualifications
3-4 years of experience in performance testing.
Proficiency in JMeter and familiarity with its plugins.
Solid understanding of performance metrics and their interpretation.
Knowledge of SQL, network analysis, and Java tools for performance investigation.
Strong documentation and reporting skills.
Experience in automating performance tests is a plus.
Join our team at Persivia | Soliton Technologies and contribute to the delivery of high-quality software applications through effective performance testing and analysis.
About Us:
Persivia and Soliton Technologies are AI-powered HealthTech platform that enables providers, payers, and large health care International organizations to deliver personalized, value-based care. By integrating clinical and claims data, we deliver real-time insights that drive improved patient outcomes, clinical performance, and operational efficiency.
Role Code:
#ST25Q4PE
Show more
Show less",Quality Assurance
4300735575,Responsible AI Trainee,CureMD,"Lahore, Punjab, Pakistan",https://pk.linkedin.com/jobs/view/responsible-ai-trainee-at-curemd-4300735575?position=3&pageNum=10&refId=9VFj1eTIYdrcYfE663juvQ%3D%3D&trackingId=cWTD260j7dqcHPR98DeGdg%3D%3D,2025-09-15,Internship,Full-time,Software Development,"Job Overview:
As a Responsible AI Trainee at CureMD you will focus on ensuring the ethical, transparent, and accountable use of AI in healthcare applications. This position is pivotal in embedding responsible AI practices into the development, deployment, and maintenance of AI systems that enhance clinical decision-making, patient management, and operational efficiencies. This role requires a blend of technical skills in AI and machine learning, a deep understanding of ethical AI principles, and familiarity with healthcare regulations. The Responsible AI Trainee will play a crucial role in ensuring that CureMD's innovative solutions not only advance healthcare outcomes but also uphold the highest standards of ethics and responsibility in AI.
Job Responsibilities:
Ethical AI Implementation: Assist in development of AI applications with a strong emphasis on ethical principles, ensuring that all AI solutions are fair, transparent, and non-discriminatory.
Compliance and Standards: Support the team in ensuring AI systems comply with healthcare regulations (e.g., HIPAA) and industry standards for data privacy and security.
Collaboration: Work closely with cross-functional teams, including clinical experts and data scientists, to integrate responsible AI practices into CureMD's product development lifecycle.
Risk Assessment: Participate in conducting thorough risk assessments for AI projects, identifying potential ethical and regulatory issues and proposing mitigation strategies.
Transparency and Accountability: Help in developing frameworks and guidelines for transparent AI decision-making processes and establish mechanisms for accountability in AI applications.
Continuous Learning: Continuous research on emerging trends and best practices in responsible AI, healthcare regulations, and ethical AI frameworks to continuously improve CureMD's AI solutions.
Qualifications:
Bachelor's degree in Computer Science, Software Engineering, Artificial Intelligence, Psychology, Social Sciences, or a related field.
Excellent problem-solving and analytical skills to address complex challenges in the field of generative AI.
Ability to think creatively and outside conventional frameworks to develop innovative solutions to complex problems.
Ability to collaborate effectively with cross-functional teams and communicate technical concepts to non-technical stakeholders.
Ability to identify and address both technical and ethical challenges in AI.
A natural curiosity and a commitment to continuous personal and professional growth, aiming to contribute positively to the development of ethical and responsible AI technologies.
Strong attention to detail and a commitment to maintaining ethical AI practices.
Master's degree in Computer Science, Software Engineering, Artificial Intelligence, Psychology, Social Sciences, or a related field.
Familiarity with responsible AI frameworks such as Fairness, Accountability, and Transparency in Machine Learning (FAT/ML).
Familiarity with programming languages like Python, TensorFlow, PyTorch, or other relevant AI frameworks.
Compensation and Benefits:
💰 Financial:
Competitive salary and bi-annual bonus.
Fast track and uncapped career growth for high performers.
Company-sponsored vehicle financing (car and bike).
Interest-free loans.
Provident Fund: CureMD matches up to 8% of your base salary.
🏥 Health and Wellness:
In-house clinic with a team of certified male and female doctors with 24/7 telemedicine service.
Hospital treatment monitoring by company doctors.
Comprehensive health coverage for your immediate family (outpatient, inpatient, maternity and parents' inpatient).
Exclusive health benefits and discounts at top class clinics and labs.
🤝🏻 Supportive Workplace:
Pick-up and drop-off services for female employees.
In-house daycare facility.
In-house gym and recreational area to unwind.
📚 Continued Learning:
Company-sponsored trainings, workshops, development programs and retreats.
Paid specialized trainings/certifications.
The Difference You’ll Make:
At CureMD, every role, whether senior or junior, plays a pivotal part in transforming healthcare. By joining our innovative team, you’ll contribute to groundbreaking technology that directly impacts patient care, enhances healthcare efficiency, and saves lives globally. Your skills and passion will drive meaningful change, helping us deliver solutions that support healthcare professionals in critical, real-time settings. Together, we’re not just advancing technology — we’re making a tangible difference in people’s lives.
Together, let’s save lives.
Show more
Show less",Other
4294994081,Production Engineer-Press,Interwood Mobel (Pvt) Ltd.,"Lahore, Punjab, Pakistan",https://pk.linkedin.com/jobs/view/production-engineer-press-at-interwood-mobel-pvt-ltd-4294994081?position=4&pageNum=10&refId=9VFj1eTIYdrcYfE663juvQ%3D%3D&trackingId=zVAnpxyjPPKqr2k75PuaKA%3D%3D,2025-09-03,Executive,Full-time,IT Services and IT Consulting,"The Production Engineer (Press) will be responsible for executing and optimizing press operations within the production line, ensuring that panels and components meet the highest quality, strength, and durability standards. The role requires hands-on involvement in machine operation, production planning, process improvement, resource utilization, and defect minimization to achieve consistent output and production targets.
Requirements
Production & Process Control
Plan, monitor, and execute daily press operations (lamination, veneer pressing, PVC, membrane, or hot/cold press)
Ensure adherence to production plans, capacity utilization, and quality standards
Monitor machine parameters (temperature, pressure, cycle time) to achieve consistent results
Optimize press cycle times to reduce bottlenecks and increase throughput
Machine Maintenance & Technical Support
Ensure preventive maintenance and troubleshooting of press machines
Coordinate with the maintenance team for breakdown repairs and equipment upgrades
Maintain technical records of machine performance and downtime
Quality Assurance
Conduct in-process inspections to ensure product quality (adhesion, finishing, dimension accuracy)
Implement corrective and preventive actions in case of defects or deviations
Support QA/QC team in root cause analysis of press-related rejections
Resource Management
Supervise press operators, helpers, and technical staff
Ensure efficient material usage (glue, veneer sheets, laminates, boards) with minimum wastage
Provide training and skill development to press section staff
Safety & Compliance
Ensure compliance with safety standards and ISO requirements
Implement 5S and lean practices in the press section
Maintain documentation for audits and compliance checks
Benefits
Medical Insurance
Provident Fund
EOBI
Paid Leaves
Easy loan and advance salary facility
Alternate Saturday Off
Show more
Show less",Production
4302577385,Software Developer,Contour Software,"Lahore, Punjab, Pakistan",https://pk.linkedin.com/jobs/view/software-developer-at-contour-software-4302577385?position=5&pageNum=10&refId=9VFj1eTIYdrcYfE663juvQ%3D%3D&trackingId=zn3IPusH5BsMVtFj74%2BspA%3D%3D,2025-09-18,,,,,
4279070092,Systems Engineer,ICE Consulting - Managed IT & Cybersecurity for Life Sciences,"Lahore, Punjab, Pakistan",https://pk.linkedin.com/jobs/view/systems-engineer-at-ice-consulting-managed-it-cybersecurity-for-life-sciences-4279070092?position=6&pageNum=10&refId=9VFj1eTIYdrcYfE663juvQ%3D%3D&trackingId=Wp3wuRYogf5sb48fLF0iWA%3D%3D,2025-08-02,Associate,Full-time,IT Services and IT Consulting,"Who We Are:
We are a privately owned leading Managed IT Services company (Managed Service Provider). Since 1996 we have specialized in providing a full range of services from Network & Security, UNIX/Linux & Windows Engineering, System & Database Administration, on-premise and cloud services, Help Desk Support, VoIP Support and maintain IT infrastructures for our clients which are made up of small to medium-sized enterprises. We are looking for highly passionate System Administrator professionals that can help elevate our MSP (Managed service Provider) and drive the growth and success of our company.
Who You Are:
A seasoned System Engineer who has experience working with consulting teams in an MSP setting. You are no stranger to managing large and complex projects. You stand out among other candidates because you possess strengths with key project characteristics from communication, preparation, monitoring, and management of project budgets, scope, schedules, risks, resource planning, and other project KPIs. You have a proven track record of dealing directly with and taking full responsibility/ownership of client relationships and can easily evaluate the customer's needs and provide the right solutions.
So here is the Job:
This is a new position, to be located at our corporate offices in Lahore, Pakistan. The role requires the ability to pull detailed data, analyze it, and provide recommendations based on their understanding of the processes, people and/or system(s) they are working with. Your project scope will fluctuate based on the business needs, you will be responsible for deploying, modifying, monitoring, and maintaining systems infrastructure on-premises or on-cloud. You will also have to integrate and maintain cloud-based applications and systems. Our environment looks like this:
Cloud Solutions & Applications
Office 365
G Suite
Okta SSO & MFA
Workspace One
Backups
AWS
Windows Systems Infrastructure
Active Directory
VMWare
Storage
Veeam
Requirements
Extensive experience and knowledge of Active Directory, DHCP, DNS services
Extensive hands-on experience with Microsoft Intune for device provisioning, configuration, and endpoint management is required
Extensive experience and knowledge of installing, configuring, and maintaining VMWare infrastructure
Extensive experience and knowledge of configuration and maintenance of enterprise storage such as NetApp or alike
Extensive experience and knowledge of installing, configuring, and maintaining Veeam backup software
A full understanding of Microsoft 365 and G Suite administration and experience supporting complex environments
In-depth knowledge related to the Office 365 applications and features including Azure Directory
Experience with SSO/MFA integration between Office 365, G Suite, Box and other major cloud service providers
Experience with MDM solution such as Workspace One is a plus
Windows Power-shell experience related to Microsoft Azure, Office 365, and Exchange Server
Understanding of systems engineering and platform architecture
Strong analytical, organizational, and problem-solving skills, as well as accuracy and attention to detail
Experience implementing and supporting Office 365 in medium-sized environments
Strong knowledge related to email security and security practices in general
Exposure of supporting systems on AWS and AWS backup is a plus
Exposure to patch management, image building (preferably using MDT),
Must have at least 5+ years Systems Administration experience
Must have 2+ years of Microsoft 365 experience including migrations
Professional and can take full ownership of individual tasks to deliver in a timely manner
Show more
Show less",Other
