id,title,company,location,link,date,seniority,employment_type,industries,description,job_function
4292074216,Senior Data Engineer,ACE Money Transfer,"Lahore, Punjab, Pakistan",https://pk.linkedin.com/jobs/view/senior-data-engineer-at-ace-money-transfer-4292074216?position=8&pageNum=22&refId=ZiyVK9%2BxMpbYJeGbqPruUA%3D%3D&trackingId=HLDXiuq263ozpmpVBISsqg%3D%3D,2025-08-27,Mid-Senior level,Full-time,Internet Publishing,"About Us:
We are a dynamic and fast-growing financial technology group headquartered in Manchester, United Kingdom, with an established presence across the UK, Europe, Canada, Australia, Pakistan, and Bangladesh. Our group, encompassing ACE Money Transfer and ACE Union, operates across two regulated verticals: Electronic Money Services (EMI) and Cross-Border Remittances.
Through our digital platforms, including mobile apps, web portals, and APIs, we deliver a comprehensive range of regulated financial services. These include digital payments, e-wallets, electronic money issuance, prepaid cards, mobile top-ups, bill payments, and international money transfers, designed to serve both individual and business customers in over 100 countries. By leveraging cutting-edge technologies such as AI for fraud detection, automation for seamless transactions, and partnerships with global leaders like Mastercard, we provide secure, user-friendly, and accessible financial solutions that adapt to the evolving needs of a global customer base.
As we scale our EMI and remittance operations amid 2025's fintech landscape—marked by real-time payments, embedded finance, blockchain integration, and sustainability initiatives—we are building a leadership team to drive innovation, regulatory compliance, and excellence across our dual-regulated ecosystem.
Job Overview:
This role is focused on designing and delivering scalable, secure, and high-performance data architectures to support the organization’s expanding analytical and operational needs. The Senior Data Engineer will work closely with cross-functional teams to understand complex data requirements, define and implement robust data transformation rules, and lead the development and optimization of end-to-end data pipelines and data warehouse infrastructure.
The ideal candidate will have hands-on experience in API based data integrations with third-party platforms, as well as a strong grasp of data governance principles. This includes implementing policies to ensure data quality, privacy, security, and compliance with regulatory standards. The role also involves optimizing workflows for cost efficiency and performance, while providing technical leadership to engineering and analytics teams in executing complex, data driven initiatives.
Key Responsibilities:
Architecting Scalable Data Systems: Designing robust data infrastructures capable of supporting increasing data volume and complexity
Design Data Pipelines: Develop efficient data ingestion pipelines and ETL processes capable of handling both structured and unstructured data effectively
Data Warehouse Management: Manage and optimize the data warehouse, ensuring efficient data storage, retrieval, and transformation. Implement best practices for organizing and managing raw, processed, and curated data, with scalability and future growth in mind
Optimize Data Modelling: Write, optimize, and maintain complex SQL queries and Python scripts to ensure efficient data processing
Streamlining Data Workflows: Enhancing data storage, processing, and access methods to improve efficiency, strengthen data observability, and reduce operational costs through targeted infrastructure optimizations
Governance & Quality: Develop and maintain data quality checks to ensure data is accurate, consistent, and regulatory compliant
Develop Integration Procedures: Design and implement processes to integrate data warehouse solutions into operational IT environments
Driving Technical Leadership: Guiding engineering and analytics teams in the execution of data-driven initiatives and innovation
Research & Development: Keep up with the latest technological trends and identify innovative solutions to address customer challenges and company priorities
Skills and Qualifications:
Bachelor’s or Master’s degree in Engineering, Computer Science, or a related field, or equivalent professional experience
Minimum of 4 years of hands-on experience in a Data Engineering or Data Architecture role
Proven experience with cloud platforms such as AWS, Azure, or GCP, with practical knowledge of their core data and infrastructure services
Proficient in using ETL tools and frameworks such as AWS Glue, Apache Airflow, Apache Spark, Kafka, Informatica, DataStage, or Talend for integrating data from multiple sources
Demonstrated expertise in setting up and managing scalable, high-performance data warehouse environments
Strong understanding of dimensional data modeling and mapping techniques, including Star, Snowflake, and Galaxy schemas
Solid understanding of data privacy regulations, including GDPR, and experience applying best practices for data security, compliance, and governance
Working knowledge of data observability principles and the full data lifecycle management
Extensive experience in designing and developing ETL architectures to support large-scale, distributed data processing
Deep knowledge of relational database concepts and advanced proficiency in SQL and Python for data manipulation and transformation
Experience working in distributed environments, including clustering, partitioning, and sharding strategies
Familiarity with building semantic models and preparing reporting and mapping documentation
Strong analytical and problem-solving skills, with a logical and solution-oriented mindset
Prior experience in the financial services sector is a plus
Powered by JazzHR
FHcxdxoRPI
Show more
Show less",Information Technology
4125487919,Cloud System Engineer,INTECH Automation & Intelligence,"Lahore, Punjab, Pakistan",https://pk.linkedin.com/jobs/view/cloud-system-engineer-at-intech-automation-intelligence-4125487919?position=9&pageNum=22&refId=ZiyVK9%2BxMpbYJeGbqPruUA%3D%3D&trackingId=INxtgaWZjOaaZzwc15UxuQ%3D%3D,2025-01-14,Mid-Senior level,Full-time,Automation Machinery Manufacturing,"About The Job
Join our Team - Your career journey starts here – not just a job, but a future.
Our Potential Opportunity :
INTECH Automation Intelligence is seeking a
Cloud Expert
to join our Information Systems & Technology team. This role is pivotal in ensuring the seamless implementation & management of innovative digital solutions, enhancing operational efficiency, and driving technological excellence across industries. As a
Cloud Expert,
you will manage, optimize, and support cloud infrastructure, focusing on Microsoft Azure and Microsoft 365, ensuring reliable, secure, and efficient IT systems while providing expert-level support to end-users. This role demands in-depth knowledge of cloud technologies, basic networking and security, and the ability to handle helpdesk tickets for cloud-based environments. INTECH’s commitment to cutting-edge technology ensures that you will contribute to building robust digital infrastructure and help implement forward-thinking IT practices to support business goals.
Our IS&T services reflect our dedication to leveraging technology for operational excellence, ensuring seamless connectivity and driving innovation for organizational success.
What You’ll Lead and Deliver:
Cloud Infrastructure Management:
Administer and manage Microsoft Azure services, including virtual machines (VMs), virtual networks, storage, and backups.
Configure and manage Microsoft Office 365 services (Exchange Online, SharePoint, Teams, etc.).
Tenant configuration and management.
Manage Microsoft Intune for device management and ensure the integration of mobile and endpoint devices with Azure AD.
Azure Entra-ID (Identity Management), manage user accounts, roles, and permissions.
Manage Active Directory (on-premises) and Azure Active Directory synchronization, policies, and user access.
Cloud Billing and License Management:
Administer cloud billing for Microsoft Azure and 365, ensuring cost optimization and monitoring of resource usage.
Manage licensing for Microsoft 365 products and other cloud services, ensuring compliance and proper allocation of resources.
Virtualization and vCenter Management:
Administer and maintain virtualized environments, including VMware vCenter and other relevant virtualization platforms.
Monitor virtual machine performance and ensure high availability and scalability within the virtualized environment.
Networking & Security:
Basic knowledge of networking concepts such as IP addressing, subnets, and VPNs.
Understand basic cloud-based security concepts including firewalls, network security, and threat management.
Antivirus and Patch Management:
Basic management of antivirus and endpoint protection within the cloud environment.
Assist in managing patch deployments across virtual machines and endpoints to ensure security compliance.
﻿Helpdesk Support and Ticket Management:
Handle user helpdesk tickets related to cloud-based applications, Office 365, and other IT services.
Provide technical support for issues related to cloud infrastructure, virtual machines, and software applications.
Collaborate with IT teams to diagnose, troubleshoot, and resolve cloud-related technical issues promptly.
Requirements:
To Be Successful in This Role, You Must Have:
Experience:
2 to 3 years of experience working with Microsoft Azure and related cloud services (Office 365, Azure AD).
Previous experience in a helpdesk or IT support role, with a focus on cloud infrastructure and services.
Experience in a multinational environment is a plus.
﻿Education:
BCS, MCS, Masters
Discipline: Computer Science, Information Technology, Software Engineering
﻿Technical Competencies:
Proven expertise in Microsoft Azure administration, including VMs, networking, storage, and identity management (Azure AD).
Hands-on experience with Microsoft 365 (Office 365, SharePoint, Teams, Exchange Online, Intune).
Knowledge of cloud billing management and license management for cloud products (Azure, Office 365, etc.).
Strong working knowledge of Active Directory (on-premises) and Azure Active Directory (AD) integration, management, and synchronization.
Experience with vCenter and VMware virtualization technologies.
Basic understanding of networking principles, including VPNs, DNS, and TCP/IP.
Familiarity with antivirus and endpoint protection software.
Certifications (Preferred):
Microsoft Certified: Azure Administrator Associate (AZ-104) or higher.
Microsoft Certified: Security, Compliance, and Identity Fundamentals.
VMware Certified Professional (VCP) or equivalent virtualization certifications.
ITIL Foundation certification (desirable).
Soft Skills:
Strong analytical and problem-solving abilities.
Strong English communication skills.
Ability to communicate technical concepts to both technical and non-technical teams.
Excellent customer service orientation with the ability to handle user tickets effectively.
Strong time management skills and the ability to manage multiple tasks simultaneously.
﻿We Offer Competitive Benefits:
Global Exposure: Opportunities to work on international projects and collaborate with global teams.
Competitive Compensation: A salary package that recognizes your expertise and contributions.
Annual Bonus: Performance-driven rewards based on your gross pay to celebrate your achievements and contributions.
In-House Lunch: Delicious meals provided during work hours to keep you fueled and focused.
Health Insurance: OPD coverage for you and your parents, plus IPD coverage for you and your dependents.
Learning Opportunities: Access to training programs, workshops, and certifications to enhance your skills.
Work-Life Balance: Paid time off, including annual leave and holidays.
Inclusive Environment: A workplace that celebrates diversity and fosters collaboration.
﻿Why Join INTECH Automation Intelligence?
At INTECH, you will have the opportunity to work with a globally renowned industrial automation and digitalization technology company. For nearly 30 years, INTECH has partnered with major oil and gas global giants to deliver innovative solutions. As we continue to lead in the Industry 4.0 era, you will be at the forefront of transformative technologies that solve real-world challenges.
What to Expect After Applying?
Explore how INTECH’s Talent Acquisition team ensures a seamless hiring journey. From embracing talent with a passion for innovation to fostering a culture of continuous learning and growth, we’re dedicated to finding and supporting the best minds in the industry.
Click Here to learn more about our hiring process and discover your path to success with us.
Our hiring process is designed to assess your skills and potential in a fair and inclusive manner. After applying, you will be guided through a structured evaluation process to ensure mutual alignment.
INTECH Automation Intelligence is proud to be an Equal Opportunity Employer
. We celebrate diversity and are committed to creating an inclusive environment for all employees.
Show more
Show less",Information Technology
4305461073,Auto Cad Engineer,Avanceon Middle East & South Asia,"Lahore, Punjab, Pakistan",https://pk.linkedin.com/jobs/view/auto-cad-engineer-at-avanceon-middle-east-south-asia-4305461073?position=10&pageNum=22&refId=ZiyVK9%2BxMpbYJeGbqPruUA%3D%3D&trackingId=JhGWnWMtwlbAD5b%2FYZ9tEA%3D%3D,2025-09-26,,,,,
4310286036,Business Performance coordinator,Zameen.com,"Lahore, Punjab, Pakistan",https://pk.linkedin.com/jobs/view/business-performance-coordinator-at-zameen-com-4310286036?position=1&pageNum=25&refId=085ejv%2BbdKOdHswmQs%2BncA%3D%3D&trackingId=tXaed%2FVCOnm58w%2FqizKGpg%3D%3D,2025-10-10,Associate,Full-time,"Real Estate, Data Infrastructure and Analytics, and Banking","Job Brief:
The job incumbent would be responsible for research-gathering data from internal stakeholders and performing analysis, presenting a range of data-driven solutions, and thereafter implementing those solutions and optimizations using analytical tools and technologies, statistically analyzes large data sets to identify effective ways of boosting organizational efficiency. Creating analytics platform, develop the capability within cross-functional teams to enable optimal resource allocation, tracking and monitoring of KPIs.
Job Responsibilities:
Compile, validate, and analyze regional performance data across sales, revenue, and operational metrics.
Develop and maintain Power BI dashboards and regional scorecards for management visibility.
Generate weekly, monthly, and quarterly performance reports, highlighting trends, gaps, and opportunities.
Coordinate with cross-functional teams (Sales, Operations, Finance, and BI) to ensure data accuracy and alignment.
Support regional leadership with ad-hoc analysis, insights, and business reviews.
Monitor KPIs and ensure timely reporting to national performance teams.
Manage data repositories and ensure consistent updates to key visibility tools.
Assist in planning sessions by providing data-backed recommendations and forecasts.
Maintain confidentiality and integrity of regional data assets.
Job Requirements:
Excellent Interpersonal Skills.
Business & Commercial Awareness.
Problem Solving Skills.
Proficient in developing SOPs/Workflows.
Expertise in Data Analysis & Visualization Tools (Excel/Looker/Power BI etc.).
Experience: 2-3 Years of relevant experience (Preferably working in the capacity of coordination with sales in terms of data driven).
Location: Lahore
Show more
Show less","Analyst, Management, and General Business"
4315017410,DevOps Engineer,KnowledgeCity,"Lahore, Punjab, Pakistan",https://pk.linkedin.com/jobs/view/devops-engineer-at-knowledgecity-4315017410?position=2&pageNum=25&refId=085ejv%2BbdKOdHswmQs%2BncA%3D%3D&trackingId=1Kcru8PxH8j%2F7TXnrVOrSQ%3D%3D,2025-10-15,Not Applicable,Contract,E-Learning Providers,"About Knowledgecity
At KnowledgeCity, we envision being the top global provider of innovative learning solutions, enabling organizations to excel in a constantly evolving business world. Our mission is to integrate continuous learning with organizational culture, promoting a growth mindset, diversity, and long-term success. By offering customized, innovative learning experiences, we maintain our commitment to accessible and inclusive education, inspiring a community of lifelong learners ready to tackle today’s challenges for a brighter, more prosperous future.
Position Overview
DevOps engineers build, test and maintain the infrastructure and tools to allow for the speedy development and release of software. DevOps practices aim to simplify the development process of software and help us improve our operating systems. This role has a strong background in software engineering and will employ DevOps tools and practices to improve the development team’s production and guide our hardworking team through the process of designing and writing a dependable codebase. This position also allows to innovate our engineering systems and practices.
Key Responsibilities
Developing, Implementing, and Maintaining DevOps Processes:
Establish and optimize DevOps methodologies and standards.
Ensure effective collaboration and communication between development and operations teams.
Integrate security practices into all DevOps processes.
Operational Efficiency
Development, deployment, and maintenance of software products and infrastructure.
Achieve and maintain a high level of operational efficiency by automating routine tasks, reducing deployment times, and minimizing downtime, particularly within AWS environments.
CI/CD Pipeline Management
Design, implement, and maintain robust CI/CD pipelines to automate deployment processes across multiple environments.
Apply cloud (AWS) computing skills to deploy upgrades and fixes.
Design, develop and implement software integrations.
Infrastructure As Code (IaC)
Develop and manage infrastructure using tools like Terraform, Ansible, or Cloud Formation to ensure scalability, reliability, and security.
Troubleshoot production issues and coordinate with the development team to streamline code deployment.
Monitoring And Incident Management
Implement and maintain monitoring solutions to ensure system health, performance, reliability, uptime, and security.
Lead incident response efforts to quickly resolve production issues.
Conduct systems tests for security, performance, and availability.
Security Best Practices
Implement security best practices in the CI/CD pipeline and throughout the infrastructure to protect sensitive data and ensure compliance with industry standards.
Continuous Improvement
Identify and implement improvements in processes, tools, and automation to enhance efficiency and reduce manual intervention.
Develop and maintain design and troubleshooting documentation.
Implement automation tools and framework.
Collaboration
Work closely with developers, QA, and other stakeholders to streamline the release process, improve code quality, and ensure seamless integration.
Collaborate with team members to improve the company’s engineering tools, systems and procedures, and data security.
Qualifications
Technical Expertise:
Strong experience in DevOps tools and technologies particularly in environments that prioritize continuous delivery and automation, with a focus on AWS services and configuration (EC2, RDS, Cloud Front, Athena, Lambda, Media Convert, etc.).
Work with a non-managed Kubernetes cluster.
Proficiency in programming languages such as Python, PHP, and others relevant to the tech stack.
Experience with Databases such as MySql, PostgreSQL, ClickHouse
Experience with DevOps tools and platforms such as IaC: Terraform, Ansible, Helm. Git, Docker, Kubernetes,
Bitbucket Pipelines and AWS/Oracle(Cloud Front, ECS, EKS, EC2, S3, IAM, EFS, WAF, etc). ELK-stack, Prometheus, Grafana.
Problem-Solving
Strong analytical and problem-solving skills with the ability to troubleshoot complex issues in a dynamic environment.
Excellent decision-making skills.
Communication
Excellent communication skills with the ability to work collaboratively across teams.
Advanced English proficiency, both written and spoken, is mandatory for effective communication with partners and clients.
Benefits
Paid time off and a supportive team environment.
Opportunities for professional growth through access to training materials and company courses.
Join Our Team
If you're driven by curiosity, eager to tackle challenges, and ready to make an impact in the fast-evolving E-Learning space, we'd love to hear from you. Join KnowledgeCity and help us make the world more professional and better!
Show more
Show less",Engineering and Information Technology
4311830754,Full Stack Engineer (React with Express),StudyWise,"Lahore, Punjab, Pakistan",https://pk.linkedin.com/jobs/view/full-stack-engineer-react-with-express-at-studywise-4311830754?position=3&pageNum=25&refId=085ejv%2BbdKOdHswmQs%2BncA%3D%3D&trackingId=aSiGV4o6bpdl328WmR%2FbSg%3D%3D,2025-10-09,Executive,Full-time,Business Consulting and Services,"We are looking for a talented Full Stack Software Engineer with strong expertise in React.js and Express. The ideal candidate will be responsible for building scalable, high-performance applications with clean, maintainable code. You will collaborate closely with product, design, and engineering teams to deliver end-to-end solutions.
Key Responsibilities
Design, develop, and maintain scalable web applications using React.js (frontend) and Express (backend).
Write clean, efficient, and testable code in TypeScript.
Use latest AI code assistants to boost work efficiency.
Implement RESTful APIs and integrate with third-party services.
Optimise applications for speed, performance, and responsiveness.
Work with databases (SQL and NoSQL) for data modelling, migrations, and queries.
Collaborate with UI/UX designers to deliver pixel-perfect interfaces.
Ensure application security, reliability, and scalability.
Participate in code reviews, testing, and debugging.
Stay updated with the latest technologies and development best practices.
Requirements
Required Skills & Qualifications:
1 year of professional experience as a Full Stack Developer.
Hands-on Experience with AI tools like Cursor AI, Claude Code, etc.
Strong knowledge of React.js, Express, and TypeScript.
Hands-on experience with REST APIs and AI Integrations.
Proficiency in working with databases such as PostgreSQL, MySQL, or MongoDB.
Solid understanding of HTML5, CSS3, and modern JavaScript (ES6+).
Familiarity with Git/GitHub and version control best practices.
Experience in writing unit and integration tests (e.g., Jest, Cypress).
Knowledge of containerization (Docker) and cloud services (AWS, GCP, or Azure) is a plus.
Strong problem-solving skills and ability to work independently as well as in a team.
Nice-to-Have Skills
Experience with microservices architecture.
Knowledge of authentication & authorisation (JWT, OAuth).
Familiarity with agile methodologies (Scrum/Kanban).
Exposure to DevOps practices and infrastructure as code (Terraform, Ansible).
Show more
Show less",Consulting
